{
  "schema_version": "1.0.0",
  "generated_at": "2026-08-11T19:32:46Z",
  "dataset_id": "clinical_correlation_synonyms_v1",
  "description": "Search synonyms, abbreviations, Latin variants, lay phrases and common misspellings for anatomy clinical correlations.",
  "global_synonyms": {
    "stomach": [
      "gaster",
      "ventriculus",
      "gastric",
      "žalúdok",
      "magen"
    ],
    "greater curvature": [
      "curvatura major",
      "great curvature",
      "inferior border of stomach",
      "inferior side of stomach",
      "big curvature",
      "outer curvature",
      "large curvature"
    ],
    "lesser curvature": [
      "curvatura minor",
      "small curvature",
      "superior border of stomach",
      "upper border of stomach",
      "inner curvature"
    ],
    "gastro-omental artery": [
      "gastroepiploic artery",
      "gastro omental artery",
      "gastroepiploic",
      "gastro-epiploic",
      "arteria gastroomentalis",
      "arteria gastroepiploica"
    ],
    "right gastro-omental artery": [
      "right gastroepiploic artery",
      "right gastro omental artery",
      "arteria gastroomentalis dextra",
      "arteria gastroepiploica dextra"
    ],
    "left gastro-omental artery": [
      "left gastroepiploic artery",
      "left gastro omental artery",
      "arteria gastroomentalis sinistra",
      "arteria gastroepiploica sinistra"
    ],
    "right gastric artery": [
      "arteria gastrica dextra"
    ],
    "left gastric artery": [
      "arteria gastrica sinistra"
    ],
    "short gastric arteries": [
      "arteriae gastricae breves",
      "short gastrics"
    ],
    "duodenum": [
      "duodenum",
      "duodenal",
      "dvanástnik",
      "zwölffingerdarm"
    ],
    "first part of duodenum": [
      "duodenal bulb",
      "superior part of duodenum",
      "pars superior duodeni",
      "D1"
    ],
    "third part of duodenum": [
      "horizontal part of duodenum",
      "inferior part of duodenum",
      "pars horizontalis duodeni",
      "D3"
    ],
    "gastroduodenal artery": [
      "arteria gastroduodenalis",
      "GDA"
    ],
    "superior mesenteric artery": [
      "arteria mesenterica superior",
      "SMA",
      "superior mesenteric a."
    ],
    "pancreas": [
      "pancreas",
      "pancreatic",
      "pankreas",
      "slinivka"
    ],
    "head of pancreas": [
      "caput pancreatis",
      "pancreatic head"
    ],
    "tail of pancreas": [
      "cauda pancreatis",
      "pancreatic tail"
    ],
    "common bile duct": [
      "ductus choledochus",
      "bile duct",
      "CBD",
      "choledochus"
    ],
    "splenic vessels": [
      "splenic artery and vein",
      "lienal vessels",
      "arteria splenica",
      "vena splenica"
    ],
    "appendix": [
      "vermiform appendix",
      "appendix vermiformis",
      "slepé črevo appendix"
    ],
    "appendicular artery": [
      "arteria appendicularis",
      "appendix artery"
    ],
    "gallbladder": [
      "vesica biliaris",
      "vesica fellea",
      "žlčník",
      "gallenblase"
    ],
    "cystic artery": [
      "arteria cystica"
    ],
    "porta hepatis": [
      "hepatic hilum",
      "liver hilum",
      "porta hepatis"
    ],
    "hepatoduodenal ligament": [
      "ligamentum hepatoduodenale",
      "free edge of lesser omentum"
    ],
    "portal triad": [
      "portal vein, hepatic artery, bile duct",
      "triad",
      "Glisson triad"
    ],
    "rib": [
      "costa",
      "rebro",
      "rippe"
    ],
    "costal groove": [
      "sulcus costae",
      "inferior border of rib",
      "under rib"
    ],
    "intercostal vein artery nerve": [
      "VAN bundle",
      "VAN",
      "intercostal neurovascular bundle",
      "vein artery nerve"
    ],
    "root of lung": [
      "radix pulmonis",
      "lung hilum",
      "hilum of lung",
      "pulmonary root"
    ],
    "phrenic nerve": [
      "nervus phrenicus"
    ],
    "vagus nerve": [
      "nervus vagus",
      "CN X",
      "cranial nerve X"
    ],
    "anterior interventricular artery": [
      "left anterior descending artery",
      "LAD",
      "ramus interventricularis anterior",
      "anterior descending artery"
    ],
    "anterior interventricular sulcus": [
      "anterior interventricular groove",
      "sulcus interventricularis anterior"
    ],
    "right coronary artery": [
      "RCA",
      "arteria coronaria dextra"
    ],
    "coronary sulcus": [
      "atrioventricular groove",
      "sulcus coronarius"
    ],
    "circumflex artery": [
      "LCx",
      "ramus circumflexus",
      "left circumflex artery"
    ],
    "foramen spinosum": [
      "spinosum",
      "foramen spinosum"
    ],
    "middle meningeal artery": [
      "arteria meningea media",
      "MMA"
    ],
    "cavernous sinus": [
      "sinus cavernosus",
      "cavernous venous sinus"
    ],
    "internal carotid artery": [
      "ICA",
      "arteria carotis interna"
    ],
    "oculomotor nerve": [
      "CN III",
      "cranial nerve III",
      "third cranial nerve",
      "nervus oculomotorius"
    ],
    "trochlear nerve": [
      "CN IV",
      "cranial nerve IV",
      "fourth cranial nerve",
      "nervus trochlearis"
    ],
    "ophthalmic nerve": [
      "V1",
      "ophthalmic division",
      "nervus ophthalmicus"
    ],
    "maxillary nerve": [
      "V2",
      "maxillary division",
      "nervus maxillaris"
    ],
    "abducens nerve": [
      "CN VI",
      "cranial nerve VI",
      "sixth cranial nerve",
      "nervus abducens"
    ],
    "parotid gland": [
      "glandula parotis",
      "parotis"
    ],
    "facial nerve": [
      "CN VII",
      "cranial nerve VII",
      "nervus facialis"
    ],
    "retromandibular vein": [
      "vena retromandibularis"
    ],
    "external carotid artery": [
      "ECA",
      "arteria carotis externa"
    ],
    "submandibular duct": [
      "Wharton duct",
      "Wharton’s duct",
      "ductus submandibularis"
    ],
    "lingual nerve": [
      "nervus lingualis"
    ],
    "carotid sheath": [
      "vagina carotica"
    ],
    "common carotid artery": [
      "CCA",
      "arteria carotis communis"
    ],
    "internal jugular vein": [
      "IJV",
      "vena jugularis interna"
    ],
    "optic canal": [
      "canalis opticus"
    ],
    "optic nerve": [
      "CN II",
      "cranial nerve II",
      "nervus opticus"
    ],
    "ophthalmic artery": [
      "arteria ophthalmica"
    ],
    "superior orbital fissure": [
      "SOF",
      "fissura orbitalis superior"
    ],
    "superior ophthalmic vein": [
      "vena ophthalmica superior"
    ],
    "hypoglossal nerve": [
      "CN XII",
      "cranial nerve XII",
      "nervus hypoglossus"
    ],
    "optic chiasm": [
      "chiasma opticum",
      "optic chiasma"
    ],
    "visual pathway": [
      "optic pathway",
      "visus pathway"
    ],
    "surgical neck of humerus": [
      "collum chirurgicum humeri",
      "humeral surgical neck"
    ],
    "axillary nerve": [
      "nervus axillaris"
    ],
    "posterior circumflex humeral artery": [
      "PCHA",
      "arteria circumflexa humeri posterior"
    ],
    "radial groove": [
      "spiral groove",
      "sulcus nervi radialis",
      "radial nerve groove"
    ],
    "humeral shaft": [
      "shaft of humerus",
      "corpus humeri"
    ],
    "radial nerve": [
      "nervus radialis"
    ],
    "profunda brachii artery": [
      "deep brachial artery",
      "arteria profunda brachii"
    ],
    "medial epicondyle": [
      "medial epicondyle of humerus",
      "epicondylus medialis humeri",
      "funny bone region"
    ],
    "ulnar nerve": [
      "nervus ulnaris"
    ],
    "carpal tunnel": [
      "canalis carpi",
      "carpal canal"
    ],
    "median nerve": [
      "nervus medianus"
    ],
    "flexor tendons": [
      "flexor muscle tendons",
      "FDS FDP FPL tendons"
    ],
    "cubital fossa": [
      "fossa cubitalis",
      "elbow fossa"
    ],
    "biceps tendon": [
      "tendon of biceps brachii"
    ],
    "brachial artery": [
      "arteria brachialis"
    ],
    "femoral triangle": [
      "trigonum femorale",
      "Scarpa triangle",
      "Scarpa’s triangle"
    ],
    "femoral nerve": [
      "nervus femoralis"
    ],
    "femoral artery": [
      "arteria femoralis"
    ],
    "femoral vein": [
      "vena femoralis"
    ],
    "lymphatics": [
      "lymph nodes",
      "lymphatic vessels"
    ],
    "adductor canal": [
      "Hunter canal",
      "subsartorial canal",
      "canalis adductorius"
    ],
    "saphenous nerve": [
      "nervus saphenus"
    ],
    "nerve to vastus medialis": [
      "nervus vasti medialis"
    ],
    "neck of fibula": [
      "fibular neck",
      "collum fibulae",
      "neck of the fibula"
    ],
    "common fibular nerve": [
      "common peroneal nerve",
      "nervus fibularis communis",
      "nervus peroneus communis"
    ],
    "popliteal fossa": [
      "fossa poplitea"
    ],
    "tibial nerve": [
      "nervus tibialis"
    ],
    "popliteal vein": [
      "vena poplitea"
    ],
    "popliteal artery": [
      "arteria poplitea"
    ],
    "tarsal tunnel": [
      "canalis malleolaris",
      "behind medial malleolus"
    ],
    "tibialis posterior": [
      "tendon of tibialis posterior"
    ],
    "flexor digitorum longus": [
      "FDL"
    ],
    "posterior tibial vessels": [
      "posterior tibial artery and veins",
      "arteria tibialis posterior"
    ],
    "flexor hallucis longus": [
      "FHL"
    ],
    "femoral neck": [
      "collum femoris",
      "neck of femur"
    ],
    "medial circumflex femoral artery": [
      "MCFA",
      "arteria circumflexa femoris medialis"
    ],
    "retinacular arteries": [
      "retinacular vessels",
      "ascending cervical branches"
    ],
    "ureter": [
      "močovod",
      "ureter"
    ],
    "uterine artery": [
      "arteria uterina"
    ],
    "obturator canal": [
      "canalis obturatorius"
    ],